{
  "schema_version": "1.0.0",
  "refund_id": "re_3MtweELkdIwHu7ix1P8GHrdT",
  "payment_id": "pi_3MtweELkdIwHu7ix0Dt0gF2H",
  "charge_id": "ch_3MtweELkdIwHu7ix0abc123",
  "amount": {
    "amount": 5000,
    "currency": "usd"
  },
  "currency": "usd",
  "status": "succeeded",
  "reason": "requested_by_customer",
  "description": null,
  "failure_reason": null,
  "receipt_number": "1234-5678",
  "external_metadata": {
    "refund_reason": "Customer requested partial refund"
  },
  "meta": {
    "created_at": "2024-03-03T00:00:00.000Z",
    "source": {
      "platform": "stripe",
      "platform_version": "v1"
    }
  }
}
